,date,article,text,sentiment
908,2023-07-29 00:00:00,Компания из Ганы объявила о желании закупить 300 пикапов УАЗ,"МОСКВА, 29 июл -- ПРАЙМ. Компания из Ганы по итогам переговоров с УАЗ на саммите ""Россия-Африка"" готова закупить 300 пикапов и надеется получить их до конца года, кроме того, стороны договорились о сборке части компонентов для автомобилей в четырех регионах страны, заявил РИА Новости председатель ганско-российского совета по развитию бизнеса Лоуренс Ауку-Боатенг.""Мы готовы к закупке 300 пикапов и надеемся получить их до конца этого года"", -- сказал Ауку-Боатенг.""Мы договорились о сборке части компонентов (для автомобилей -- ред.) в Гане. Мы обсудили планы, согласно которым, сборка будет осуществляться в четырёх регионах страны"", -- добавил он.",neutral
590,2023-11-02 00:00:00,Главные новости: Apple готовится представить отчетность,"Investing.com — Американские фьючерсы ушли в «зеленую» зону, пока рынок изучает заявления главы ФРС Джерома Пауэлла после решения центрального банка США оставить процентную ставку на прежнем уровне в течение второго заседания подряд. Компания Apple (: ) готовится представить свой последний отчет за 3 месяца, и аналитики также ожидают от технологического гиганта каких-либо рекомендаций относительно торгов в течение решающего последнего квартала. Shell (LON: ) увеличила объем выкупа акций, что способствовало росту акций нефтяного концерна.Американские фондовые фьючерсы в четверг торгуются выше, пока инвесторы «переваривают» решение Федеральной резервной системы оставить процентную ставку без изменений.К 05:55 по восточному времени (09:55 по Гринвичу) контракт на Dow прибавил 102 пункта, или 0,3%, фьючерс на S&P 500 — 22 пункта, или 0,5%, а  — 107 пунктов, или 0,7%.В среду Комитет по открытому рынку ФРС США принял решение сохранить ключевую ставку по федеральным фондам на прежнем уровне в диапазоне от 5,25% до 5,50%, хотя председатель Комитета Джером Пауэлл отметил, что до снижения инфляции до целевого уровня 2% еще предстоит долгий путь.После публикации этого сообщения базовый индекс  вырос на 1,1%, а  из 30 акций и технологический Nasdaq Composite — на 0,7% и 1,6% соответственно. Европейские и азиатские рынки акций последовали за Уолл-стрит в росте, что может свидетельствовать о том, что глобальные инвесторы становятся более уверенными в том, что ФРС закончила ужесточение политики в этом году.Курс доллара снизился по отношению к корзине валют-аналогов, а цена  — крупнейшей в мире криптовалюты по рыночной стоимости — достигла максимальной отметки с мая 2022 года.Решение ФРС сохранить стоимость заимствований на более чем 20-летнем максимуме, возможно, вызвало широкий отклик на рынке, уставшем после нескольких месяцев беспрецедентного повышения ставки, однако Пауэлл в ходе внимательно отслеживаемой пресс-конференции после заседания отметил, что чиновники все еще задаются вопросом о целесообразности дальнейшего повышения ставки.Пока же он подчеркнул, что ФРС будет действовать осторожно, заявив, что в настоящее время денежно-кредитная политика находится на ограничительном уровне.Это заявление вызвало некоторые сомнения, особенно на фоне неожиданно сильных данных, которые намекнули на удивительную устойчивость американской экономики. Эта тенденция, в свою очередь, вызвала опасения, что недавнее охлаждение инфляции может сойти на нет.Однако Пауэлл сохранил уверенность в том, что инфляция продолжит замедляться, хотя и частично. В любом случае, комментарии Пауэлла указывают на то, что перед ФРС стоит непростая задача: сдерживать ценовое давление, не вызывая при этом глубокого экономического спада.Теперь внимание переключится на компанию Apple, поскольку технологический гигант готовится представить отчетность за третий квартал после закрытия торгов в четверг.Для акций производителя iPhone 2023 год пока что был позитивным. За это время акции компании выросли чуть более чем на 30%. Трейдеров успокаивают популярные продукты компании и стабильный денежный поток.Однако в четвертом финансовом квартале ожидается, что продажи компании составят $89,28 млрд, что означает падение примерно на 1% по сравнению с аналогичным периодом прошлого года и четвертое квартальное падение подряд.В качестве угрозы для последнего квартала аналитики называют возможное снижение спроса на ключевом для компании китайском рынке и слабые настроения в сфере потребительских расходов. Так, аналитики  (LON:) предупредили, что прогнозы Apple на текущий квартал, который обычно является самым крупным в связи с праздничным сезоном покупок, могут не оправдать ожиданий Уолл-стрит.Акции Shell, котирующиеся в Лондоне, подскочили в начале торгов после того, как нефтяная компания объявила об обратном выкупе акций на сумму $3,5 млрд в течение следующих 3 месяцев по сравнению с $2,7 млрд в предыдущем квартале.При этом компания оставила дивиденды на уровне $0,331 на акцию, несмотря на квартальные результаты, которые главный исполнительный директор компании Ваэль Саван в своем заявлении назвал сильными.Скорректированная прибыль Shell за третий квартал в размере $6,2 млрд соответствовала рыночным оценкам компании, хотя в годовом исчислении этот показатель был на 34% ниже. Устойчивая торговля подразделения по производству сжиженного природного газа помогла компенсировать падение цен на энергоносители и снижение производства в его интегрированном газовом подразделении«Мы продолжаем упрощать наш портфель, создавая при этом большую стоимость при меньших выбросах», — сказал Ваэль.Цены на нефть выросли в четверг, прервав трехдневное падение, после того как ФРС оставила процентную ставку на прежнем уровне, что повлияло на курс доллара и способствовало возвращению склонности к риску на финансовые рынки.К 05:55 по восточному времени фьючерс на  торговался на 1,6% выше, по $81,72 за баррель, а контракт на  поднялся на 1,4%, до $85,83 за баррель. На предыдущей сессии оба эталона установились на многонедельных минимумах, упав в октябре примерно на 10%.Рынок нефти основном торгуется без учета данных по запасам нефти в США: официальные данные Управления энергетической информации показали несколько меньший, чем ожидалось, рост запасов нефти за неделю, завершившуюся 27 октября.Запасы дистиллятов сократились меньше, чем ожидалось, в то время как запасы бензина выросли неожиданно, но незначительно. и",neutral
380,2023-11-17 00:00:00,"Банк России заявил, что не покупает бумаги госдолга США","Investing.com — Банк России не имеет казначейских обязательств США и не приобретает эти бумаги. Об этом агентству ТАСС  в пресс-службе Центробанка.«У Банка России нет казначейских обязательств США, мы эти бумаги не приобретаем. Информацию по объему вложений различных стран в эти бумаги может прокомментировать только Казначейство США», — сообщил регулятор.Сегодня утром из данных Минфина США стало известно, что Россия  объем вложений в американские гособлигации в сентябре до $73 млн. Однако в данных речь шла только про иностранных резидентов (U.S. Treasury Securities Held by Foreign Residents). и",neutral
70,2024-03-10 00:00:00,Топ-5 недели: данные по инфляции в США и взлет биткоина,"Investing.com — Февральские данные, включая потребительские цены и розничные продажи в США, дадут дополнительные сигналы о перспективах потенциального снижения ставки Федеральной резервной системой. BTC достиг рекордного максимума, а Уолл-стрит может ждать еще одна волатильная неделя. Вот что нужно знать в начале недели.Во вторник инвесторы будут следить за данными по инфляции в США, пытаясь определить, как скоро ФРС может начать снижать процентную ставку.Экономисты ожидают, что февральский индекс потребительских цен вырастет на 0,4% после более быстрого, чем ожидалось, роста на 0,3% в январе.В четверг глава ФРС Джером Пауэлл заявил, что снижение ставки, вероятно, будет уместным в какой-то момент в этом году, но дал понять, что он и его коллеги еще не готовы к этому.Наблюдатели за рынком также будут следить за выходящими в четверг данными по розничным продажам за февраль, которые, как ожидается, поднимутся на 0,8% после падения на ту же величину месяцем ранее.В экономическом календаре также представлены данные по промышленному производству, настроениям потребителей и еженедельные данные по первичным заявкам на пособие по безработице в США.На неделе у чиновников ФРС начнется традиционный период паузы в преддверии предстоящего заседания.BTC достиг нового исторического максимума выше $70 000, чему способствовал спрос инвесторов на новые американские спотовые биткоин-фонды ETF, запущенные в этом году, и ожидания снижения процентной ставки в мире.За последние несколько недель в ETF влились миллиарды долларов. Кроме того, рынок получил поддержку в преддверии ожидаемого обновления платформы блокчейна ETH, на которой размещен вторая по величине цифровая валюта — , и халвинга биткоина, который замедлит процесс его майнинга в апреле.За предыдущим бумом биткоина в 2021 году последовала «криптозима», когда банкротства и крахи крупнейших криптовалютных компаний оставили без средств к существованию миллионы инвесторов, что заставило регуляторов усилить предупреждения о рисках.Но это, похоже, не остановило новую волну притока денег. Поклонники криптовалют говорят, что индустрия стала более зрелой, но центральные банки и регуляторы по-прежнему насторожены. Теперь инвесторы задаются вопросом: насколько масштабным может стать этот процесс и изменится ли он на этот раз?Цены на нефть в пятницу закрылись на 1% ниже, а за неделю упали еще больше, поскольку рынок по-прежнему опасается низкого спроса со стороны Китая, даже несмотря на то, что группа производителей ОПЕК+ продлила сокращение поставок.Оба эталона упали за неделю:  — на 1,8%, а  — на 2,5%.На прошлой неделе Китай установил целевой показатель экономического роста на 2024 год на уровне около 5%, что, по мнению многих аналитиков, является амбициозным без дополнительных стимулов.Что касается предложения, то в минувшее воскресенье члены ОПЕК+ во главе с Саудовской Аравией и Россией договорились продлить добровольное сокращение добычи нефти на 2,2 млн баррелей в день на второй квартал, что оказало дополнительную поддержку рынку на фоне опасений по поводу глобального роста и увеличения добычи за пределами группы.Трейдеры на рынке энергоносителей также сосредоточили внимание на сроках возможного снижения ставок ФРС и ЕЦБ. Снижение процентных ставок может повысить спрос на нефть за счет ускорения экономического роста.Три основных индекса на Уолл-стрит завершили прошлую пятницу снижением: после недавнего ралли на буме искусственного интеллекта Nvidia (: ) перешла к откату.За неделю  потерял 0,26%, Nasdaq упал на 1,17%, а  — на 0,93%.Nvidia завершила пятницу снижением более чем на 5%, что стало худшим результатом за день с конца мая. Акции компании все же завершили неделю ростом более чем на 6% на фоне ралли, которое увеличило ее рыночную стоимость более чем на $1 трлн в этом году.Аналитики говорят, что инвесторы фиксируют прибыль после недавнего роста рынка.Учитывая, что предстоящих данных по инфляции, скорее всего, будет недостаточно, чтобы убедить ФРС в том, что ценовое давление охлаждается достаточно быстро, чтобы оправдать ближайшие шаги, участники рынка, вероятно, сохранят некоторую осторожность.Во вторник в Великобритании выйдет последний отчет по рабочим местам. Инвесторы и Банк Англии сосредоточатся на росте заработной платы на фоне спекуляций по поводу сроков первого снижения ставки.Средняя почасовая оплата труда в декабре замедлилась до 6,2%, что является самым медленным темпом роста за последний год, но не настолько медленным, чтобы убедить чиновников Банка Англии в том, что процентная ставка, находящаяся на 16-летнем максимуме, должна быть снижена скорее раньше, чем позже.Тем временем в еврозоне выйдут данные по промышленному производству за январь. Декабрьский отчет показал значительный рост производства, который свел на нет весь год спада. Еще одно сильное показание станет обнадеживающим знаком для роста ВВП в первом квартале.Если вы ищете платформу, которая позволит вам с легкостью анализировать рыночные инструменты и отбирать именно те, которые подходят для вашего портфеля и вашего стиля инвестирования, как это делают наши авторы, предлагаем вам воспользоваться .А мы дарим вам купон на дополнительную скидку 10% на двухгодовую подписку: PRO4EVERYONE.Не забудьте ввести купон в специальное поле при ! и",neutral
806,2023-07-30 00:00:00,МЧС подтвердило гибель восьми человек в палаточном лагере в Марий Эл,"МОСКВА, 30 июл -- ПРАЙМ. Число погибших в результате удара стихии на месте палаточного лагеря на озере Яльчик в Марий Эл увеличилось до восьми, пострадали 29 человек, сообщили РИА Новости в пресс-службе МЧС России.""Спасатели МЧС России продолжают работы по ликвидации последствий стихии в Республике Марий Эл. В частности на месте палаточного лагеря на озере Яльчик и подъездных путей. К сожалению, число погибших выросло до восьми, пострадало 29 человек. В медицинские учреждения госпитализированы 16 человек"", -- сказано в сообщении.Ранее региональное управление МЧС РФ сообщило, что от урагана в Марий Эл 22 человека пострадали, еще семь погибли, включая детей.Также отмечается, что в результате прохождения опасных метеорологических явлений на территории Приволжья погибли десять человек, пострадали 76.После гибели восьми человек возбуждено уголовное дело по статье о предоставлении небезопасных услуг, приведших к смерти, сообщается в телеграм-канале Следственного комитета России.По данным СК РФ, на территории палаточного лагеря обнаружены тела 7 человек, из них трое малолетних детей. Еще один человек, находясь в тяжёлом состоянии, скончался в больнице.""Следственными органами СК РФ по Республике Марий Эл возбуждено уголовное дело по факту оказания руководством ФГБУ ""Национальный парк ""Марий Чодра"" услуг, не отвечающих требованиям безопасности жизни и здоровья потребителей, причинивших по неосторожности смерть двум и более лицам (часть 3 статья 238 УК РФ)"", -- сказано в сообщении.Председатель СК РФ Александр Бастрыкин поручил руководителю СУ СК России по Республике Марий Эл Евгению Тумандейкину доложить о ходе расследования уголовного дела.",neutral
